{
  "version": "2.0",
  "id": "minimal-v2",
  "title": "Minimal v2 Example",
  "subtitle": "ç”¨äºå›å½’æµ‹è¯•ä¸å¿«é€Ÿé¢„è§ˆ",
  "templateId": "chapter2",
  "accent": "cyan",
  "pages": [
    {
      "id": "hero",
      "page": 0,
      "kind": "hero",
      "accent": "cyan",
      "dataTitle": "Demo",
      "dataSub": "Hero",
      "header": {
        "badge": { "text": "DEMO" },
        "badgeHtml": "",
        "title": "Minimal v2",
        "subtitle": "JSON â†’ æ¨¡æ¿ â†’ æ¸²æŸ“",
        "extraHtml": "",
        "delay": 200,
        "speed": 28
      },
      "blocks": []
    },
    {
      "id": "content",
      "page": 1,
      "kind": "section",
      "accent": "purple",
      "dataTitle": "Blocks",
      "dataSub": "Regression",
      "header": { "label": "Demo", "title": "Blocks", "descHtml": "å›å½’æµ‹è¯•å¸¸ç”¨ block" },
      "blocks": [
        { "type": "microLead", "text": "cardsGrid / codeBlock / living" },
        {
          "type": "cardsGrid",
          "columns": 2,
          "cards": [
            { "accent": "cyan", "icon": "ğŸ§©", "title": "cardsGrid", "text": "å¸ƒå±€æ£€æŸ¥" },
            { "accent": "purple", "icon": "ğŸ§ ", "title": "living", "text": "äº¤äº’æ£€æŸ¥" }
          ]
        },
        { "type": "codeBlock", "file": "demo.py", "code": "print('hello')\n" },
        {
          "type": "living",
          "title": "é€è¡Œå¯è§†åŒ–",
          "vizTitle": "visualization",
          "hint": "ç‚¹å‡»å·¦ä¾§ä»£ç è¡Œ",
          "steps": [
            { "id": "s1", "label": "Step1", "code": "qkv = Wqkv @ x", "viz": { "bullets": ["QKV æŠ•å½±"] } },
            { "id": "s2", "label": "Step2", "code": "attn = softmax(q @ k.T) @ v", "viz": { "bullets": ["æ³¨æ„åŠ›è®¡ç®—"] } }
          ]
        }
      ]
    }
  ]
}

